orderid,first_x,first_y,last_x,last_y,start_loc,end_loc
377664,121.406,31.275,121.42200000000001,31.274,上海市普陀区新村路2236号,上海市宝山区大华路211号
45421,121.36399999999999,31.122,121.375,31.115,上海市闵行区嘉闵高架路,上海市闵行区莘沥路392号
301124,121.34,31.276,121.348,31.281,上海市嘉定区嘉泽路,上海市普陀区金昌路
336945,121.31299999999999,31.198,121.316,31.193,上海市闵行区涞港路,上海市闵行区涞港路
262262,121.417,31.218000000000004,121.42399999999999,31.221,上海市长宁区玉屏南路113弄-17号,上海市长宁区凯旋路478号
1295643,121.397,31.269000000000002,121.405,31.274,上海市普陀区清涧路,上海市普陀区新村路
280279,121.37700000000001,31.272,121.38600000000001,31.291999999999998,上海市普陀区绥德路552号,上海市普陀区祁连山路918号-甲
1752909,121.354,31.243000000000002,121.355,31.241999999999997,上海市长宁区S20(外环高速),上海市长宁区广顺北路
967373,121.456,31.230999999999998,121.456,31.233,上海市静安区南京西路1533号,上海市静安区铜仁路267号
1176038,121.432,31.249000000000002,121.45,31.250999999999998,上海市普陀区东新支路75号,上海市普陀区江宁路1220号
1263274,121.402,31.241,121.40899999999999,31.225,上海市普陀区怒江北路193号,上海市长宁区长宁路1898弄
1695530,121.448,31.259,121.455,31.253,上海市普陀区中潭路87号,上海市普陀区澳门路4号
693151,121.5,31.287,121.507,31.285,上海市虹口区玉田支路16号一楼,上海市杨浦区赤峰路63-2号
996216,121.405,31.241999999999997,121.416,31.24,上海市普陀区怒江路600弄,上海市普陀区梅岭南路326号
697529,121.491,31.395,121.5,31.399,上海市宝山区同济路525号,上海市宝山区永乐路549号
985786,121.469,31.283,121.48200000000001,31.281999999999996,上海市虹口区北宝兴路531号,上海市虹口区水店路365号
1170496,121.432,31.206999999999997,121.439,31.206,上海市长宁区新华路329弄41号甲,上海市徐汇区淮海西路
1611323,121.344,31.160999999999998,121.351,31.165,上海市闵行区X211(中春路),上海市闵行区七莘路3333号-3区-2号-101室
1414297,121.45100000000001,31.28,121.458,31.288,上海市闸北区万荣路389-393号,上海市闸北区共和新路2544
1196347,121.491,31.272,121.495,31.275,上海市虹口区山阴路9号,上海市虹口区欧阳路355号
137150,121.348,31.154,121.36,31.151999999999997,上海市闵行区中春路7768号,上海市闵行区宝联路88弄
435645,121.412,31.229,121.42200000000001,31.232,上海市普陀区中山北路3671弄-628号,上海市普陀区万航渡路
1582278,121.42200000000001,31.249000000000002,121.455,31.23,上海市普陀区G312(武宁路),上海市静安区常德路160号
361294,121.316,31.24,121.319,31.241,上海市嘉定区爱特路288,上海市嘉定区金园一路
1536528,121.445,31.165,121.45299999999999,31.17,上海市徐汇区石龙支路,上海市徐汇区龙吴路293号
1605291,121.338,31.256,121.34299999999999,31.243000000000002,上海市嘉定区临洮路,上海市嘉定区北翟路1444弄
1441802,121.484,31.205,121.5,31.215999999999998,上海市黄浦区瞿溪路1026号,上海市黄浦区普育西路112弄-6号
496573,121.493,31.29,121.507,31.281999999999996,上海市虹口区东体育会路880弄-16号,上海市杨浦区大连西路50号
1352183,121.449,31.199,121.471,31.21,上海市徐汇区辛耕路152号,上海市黄浦区肇嘉浜路128号-2楼-229室
1209838,121.38,31.194000000000003,121.38600000000001,31.189,上海市长宁区黄桦路70号,上海市闵行区合川路43号
1698313,121.551,31.278000000000002,121.554,31.276,上海市杨浦区平凉路1889弄-25号,上海市杨浦区隆昌路235
1410597,121.274,31.165,121.279,31.166999999999998,上海市青浦区西向阳河路,上海市青浦区叶联路
599320,121.477,31.199,121.48700000000001,31.201999999999998,上海市黄浦区龙华东路922号,上海市黄浦区龙华东路369号2楼
70865,121.382,31.101999999999997,121.382,31.103,上海市闵行区沁春路1366弄58,上海市闵行区沁春路1366弄58
468948,121.48299999999999,31.256999999999998,121.491,31.247,上海市闸北区交通路69号,上海市黄浦区江西中路451号415室
1454558,121.49799999999999,31.217,121.501,31.22,上海市黄浦区徽宁路271号,上海市黄浦区江阴街99号
1011250,121.272,31.377,121.279,31.38,上海市嘉定区博乐南路42号,上海市嘉定区叶城路
1407777,121.413,31.195999999999998,121.42299999999999,31.204,上海市闵行区红松东路,上海市长宁区长顺路11号706c
1093855,121.441,31.191999999999997,121.45100000000001,31.194000000000003,上海市徐汇区裕德路165,上海市徐汇区斜土路2590弄-2号
495155,121.495,31.325,121.522,31.285999999999998,上海市宝山区殷高路,上海市杨浦区抚顺路223号
410068,121.51799999999999,31.294,121.531,31.315,上海市杨浦区国权路225号,上海市杨浦区长海路276号
1692904,121.495,31.291,121.51899999999999,31.291,上海市虹口区东体育会路924号,上海市杨浦区中山北二路768
603967,121.521,31.326,121.53399999999999,31.331,上海市杨浦区江湾城路,上海市杨浦区开鲁路500号
801692,121.412,31.2,121.43700000000001,31.191,上海市长宁区伊犁南路393号,上海市徐汇区凯旋路2588号-7
1525433,121.439,31.259,121.443,31.256999999999998,上海市普陀区光新路250弄,上海市普陀区中潭路99弄215号
1433377,121.473,31.318,121.484,31.334,上海市闸北区临汾路,上海市宝山区晨帆路
715635,121.46700000000001,31.195999999999998,121.47,31.197,上海市徐汇区中山南二路508,上海市徐汇区中山南二路274-3号-临
468483,121.536,31.269000000000002,121.54,31.274,上海市杨浦区兰州路790号,上海市杨浦区长阳路1568号
1757281,121.42200000000001,31.274,121.42299999999999,31.274,上海市宝山区大华路211号,上海市宝山区大华路
679369,121.48299999999999,31.171,121.515,31.214000000000002,上海市浦东新区德州路,上海市浦东新区南栈大道
1104166,121.455,31.218000000000004,121.45700000000001,31.225,上海市徐汇区淮海中路1390弄-3号-1楼,上海市静安区富民路146号
775542,121.419,31.166999999999998,121.42,31.166999999999998,上海市徐汇区虹漕南路214号,上海市徐汇区虹漕南路153-155号
445894,121.45100000000001,31.293000000000003,121.471,31.302,上海市闸北区平陆路,上海市虹口区广粤支路72号
1153749,121.493,31.18,121.494,31.18,上海市浦东新区耀华路318,上海市浦东新区长清路16号
829936,121.48299999999999,31.29,121.486,31.296999999999997,上海市虹口区水电路794号,上海市虹口区新市南路
1489870,121.508,31.271,121.516,31.272,上海市虹口区虹关路88号,上海市杨浦区飞虹路600号
1243262,121.47,31.261999999999997,121.478,31.269000000000002,上海市闸北区共和新路736弄,上海市闸北区青云路400号
609461,121.421,31.218000000000004,121.471,31.24,上海市长宁区武夷路776号,上海市静安区北京西路509-511
694360,121.478,31.27,121.5,31.261999999999997,上海市闸北区宝昌路737号,上海市虹口区梧州路348号
28850,121.432,31.165,121.465,31.21,上海市徐汇区浦北路,上海市徐汇区襄阳南路533弄1-3号
420382,121.443,31.301,121.448,31.305,上海市闸北区江场三路238号9楼,上海市闸北区万荣一路1501号
1584579,121.429,31.28,121.45100000000001,31.285,上海市宝山区华灵路510弄-3号,上海市闸北区广中西路378号
1064869,121.445,31.208000000000002,121.449,31.213,上海市徐汇区余庆路90弄-2号,上海市徐汇区淮海中路1735弄-1-～2号
1316662,121.421,31.268,121.42399999999999,31.261999999999997,上海市普陀区广泉路,上海市普陀区礼泉路32号
135972,121.469,31.296999999999997,121.48299999999999,31.289,上海市虹口区广粤路439弄,上海市虹口区水电路731号
1116856,121.49,31.304000000000002,121.495,31.305,上海市虹口区车站西路169号,上海市杨浦区逸仙路333号
334508,121.544,31.232,121.54799999999999,31.228,上海市浦东新区源深路990号,上海市浦东新区丁香路425号
361535,121.40299999999999,31.205,121.40799999999999,31.204,上海市长宁区延安西路2358号-7,上海市长宁区红宝石路66号
1533789,121.367,31.258000000000003,121.376,31.258000000000003,上海市嘉定区曹安路1901号,上海市嘉定区曹安公路1923号
375033,121.32,31.233,121.33,31.226999999999997,上海市闵行区北翟路3318弄-3支弄-18号,上海市闵行区北翟路2935号
1207165,121.58200000000001,31.266,121.587,31.264,上海市浦东新区金桥路699号,上海市浦东新区金桥路1009号
758050,121.435,31.265,121.443,31.279,上海市普陀区交通路2405甲,上海市闸北区沪太路903弄-17号
592131,121.40700000000001,31.357,121.41,31.358,上海市宝山区顾村镇街,上海市宝山区泰和西路3493弄-74号
1632814,121.48700000000001,31.269000000000002,121.491,31.267,上海市虹口区横浜路89号,上海市虹口区四川北路1878号
1402360,121.478,31.271,121.479,31.27,上海市闸北区中山北路184号,上海市闸北区青云路321号-乙
1148684,121.493,31.265,121.49700000000001,31.263,上海市虹口区邢家桥北路205,上海市虹口区哈尔滨路291号
824903,121.321,31.148000000000003,121.33,31.147,上海市松江区,上海市松江区沪松公路1301号
842158,121.47,31.236,121.48100000000001,31.237,上海市静安区青海路44号,上海市黄浦区人民大道130号
473519,121.506,31.329,121.514,31.333000000000002,上海市杨浦区国泓路,上海市杨浦区淞沪路1332号
524139,121.27600000000001,31.272,121.296,31.271,上海市嘉定区曹丰路472号,上海市嘉定区浦环路
1297184,121.524,31.16,121.539,31.156999999999996,上海市浦东新区劳安路80号,上海市浦东新区西泰林路
1518418,121.48,31.333000000000002,121.486,31.340999999999998,上海市宝山区高境路,上海市宝山区新一路8号
911723,121.46,31.250999999999998,121.478,31.265,上海市闸北区恒丰路500号,上海市闸北区通阁路160号
1138373,121.45100000000001,31.156,121.463,31.168000000000003,上海市徐汇区罗城路,上海市徐汇区龙耀路
1210748,121.492,31.291999999999998,121.51299999999999,31.299,上海市虹口区中山北二路2000号,上海市杨浦区国年路172号
1279625,121.464,31.264,121.48700000000001,31.23,上海市闸北区芷江西路393弄-21号,上海市黄浦区西藏南路28
1198418,121.50299999999999,31.329,121.506,31.329,上海市杨浦区国权北路579弄-28号,上海市杨浦区国泓路
1648092,121.37799999999999,31.249000000000002,121.42299999999999,31.238000000000003,上海市普陀区吉镇路445弄64号,上海市普陀区宁夏路497号
587148,121.36,31.214000000000002,121.361,31.217,上海市长宁区环绿路,上海市长宁区S20(外环高速)
951260,121.399,31.177,121.40100000000001,31.177,上海市闵行区莲花路2088弄-50号,上海市徐汇区虹梅路2007号-3号楼
1115546,121.48299999999999,31.208000000000002,121.493,31.205,上海市黄浦区鲁班路499丙,上海市黄浦区制造局路八三三弄7甲
428901,121.478,31.221,121.48,31.221999999999998,上海市黄浦区复兴中路185号,上海市黄浦区淡水路247号
32616,121.477,31.205,121.48,31.2,上海市黄浦区打浦路284弄-18,上海市黄浦区龙华东路749号
684665,121.48,31.294,121.485,31.303,上海市虹口区广灵四路360弄-15号,上海市虹口区车站北路188号
324656,121.43799999999999,31.239,121.46,31.226,上海市静安区武宁南路462号,上海市静安区襄阳北路6弄
304327,121.311,31.285999999999998,121.321,31.294,上海市嘉定区翔铁西路,上海市嘉定区杨子路658号
32690,121.288,31.195,121.29700000000001,31.188000000000002,上海市青浦区崧泽大道,上海市青浦区徐民路
517529,121.495,31.308000000000003,121.516,31.304000000000002,上海市杨浦区逸仙路655弄,上海市杨浦区邯郸路383号
1045973,121.505,31.268,121.506,31.268,上海市虹口区瑞虹路121号,上海市虹口区瑞虹路133号
1361435,121.396,31.311,121.406,31.308000000000003,上海市宝山区南陈路106弄-202号,上海市宝山区南大路206弄-54-～24号
1384194,121.428,31.256,121.435,31.259,上海市普陀区石泉路300号,上海市普陀区石泉路76号
1189302,121.53200000000001,31.189,121.537,31.179000000000002,上海市浦东新区华绣路,上海市浦东新区华春路
903169,121.46600000000001,31.276,121.478,31.26,上海市闸北区洛川东路367号,上海市闸北区中兴路710号
13035,121.473,31.273000000000003,121.48100000000001,31.296,上海市闸北区平型关路108弄-17,上海市虹口区汶水东路690弄-13号
1166629,121.51100000000001,31.171999999999997,121.521,31.166,上海市浦东新区杨新东路72号,上海市浦东新区东明路2087-临
996039,121.44,31.193,121.448,31.206999999999997,上海市徐汇区蒲汇塘路100号,上海市徐汇区德昌路20弄
456516,121.46600000000001,31.194000000000003,121.46799999999999,31.194000000000003,上海市徐汇区中山南二路595号4f,上海市徐汇区枫林路
225748,121.40799999999999,31.233,121.41,31.232,上海市普陀区枣阳路525号,上海市普陀区枣阳路
1078872,121.492,31.285,121.49700000000001,31.288,上海市虹口区东体育会路432号-2-4,上海市虹口区赤峰路373号
160739,121.48700000000001,31.381,121.50200000000001,31.35,上海市宝山区,上海市宝山区淞发路83号
1640772,121.417,31.24,121.43,31.248,上海市普陀区梅岭支路66号,上海市普陀区凯旋北路
1674774,121.42200000000001,31.243000000000002,121.432,31.246,上海市普陀区曹杨路623弄-14-21号,上海市普陀区东新路
335281,121.581,31.255,121.594,31.246,上海市浦东新区金杨路273弄-25,上海市浦东新区黄杨路
910934,121.45700000000001,31.208000000000002,121.46,31.206999999999997,上海市徐汇区乌鲁木齐南路177弄-6号,上海市徐汇区肇嘉浜路597号
257805,121.446,31.279,121.49,31.276,上海市闸北区宜川路,上海市虹口区甜爱路200号
53008,121.535,31.041999999999998,121.541,31.041999999999998,上海市闵行区盐铁路,上海市闵行区北徐支路
421540,121.413,31.272,121.42399999999999,31.289,上海市普陀区富平路737弄-5号-1402,上海市宝山区行知路251弄-21号
18488,121.49799999999999,31.217,121.5,31.22,上海市黄浦区徽宁路271号,上海市黄浦区江阴街139号
444880,121.48899999999999,31.311,121.494,31.311,上海市虹口区新市北路1501弄-2号,上海市杨浦区仁德路67弄-10支弄-22号
732591,121.334,31.29,121.382,31.26,上海市嘉定区槎溪路,上海市嘉定区铜川路2299号
744035,121.476,31.232,121.48,31.235,上海市黄浦区大沽路254-1号,上海市黄浦区人民大道227号
264581,121.464,31.23,121.46600000000001,31.232,上海市静安区延安中路549号,上海市静安区茂名北路147号
807491,121.36200000000001,31.218000000000004,121.40299999999999,31.199,上海市长宁区协和路233号,上海市长宁区虹桥路1702-2-临
1773276,121.479,31.395,121.48100000000001,31.399,上海市宝山区,上海市宝山区宝杨路1801号
539553,121.536,31.259,121.54799999999999,31.269000000000002,上海市杨浦区杨树浦路1001弄,上海市杨浦区杭州路490号
614521,121.427,31.250999999999998,121.431,31.247,上海市普陀区中山北路2605弄50号,上海市普陀区东新路230弄-20号
1801422,121.479,31.3,121.48,31.3,上海市虹口区车站南路407弄-18号,上海市虹口区车站南路407弄-23号
1234017,121.463,31.184,121.469,31.188000000000002,上海市徐汇区宛平南路1440号甲,上海市徐汇区东安路
1087900,121.52,31.291999999999998,121.523,31.293000000000003,上海市杨浦区政本路,上海市杨浦区国权路95弄-17号
1724753,121.507,31.273000000000003,121.51100000000001,31.276,上海市虹口区天镇路140号,上海市虹口区大连路
734495,121.584,31.334,121.59,31.334,上海市浦东新区X557(浦东北路),上海市浦东新区行南公路531号
31128,121.385,31.291999999999998,121.38600000000001,31.291,上海市普陀区祁连山路918号,上海市普陀区祁连山路868号
1628170,121.38799999999999,31.176,121.40299999999999,31.16,上海市闵行区合川路,上海市闵行区莲花路1152号
285473,121.39399999999999,31.33,121.397,31.322,上海市宝山区,上海市宝山区泮池北路
1620226,121.31,31.143,121.36,31.141,上海市松江区G15(沈海高速),上海市闵行区华友路550号
1012522,121.42200000000001,31.247,121.429,31.246,上海市普陀区中山北路,上海市普陀区武宁路200弄29
826883,121.431,31.261999999999997,121.459,31.266,上海市普陀区管弄路252弄-5-～40号,上海市闸北区谈家桥路85
368013,121.40700000000001,31.21,121.44,31.194000000000003,上海市长宁区万山路29-临,上海市徐汇区文定路82号
1244562,121.448,31.305999999999997,121.476,31.299,上海市闸北区万荣路1505,上海市虹口区凉城路585弄-36号
316677,121.45200000000001,31.193,121.462,31.206,上海市徐汇区零陵路625号,上海市徐汇区医学院路69号
857361,121.42200000000001,31.255,121.447,31.261,上海市普陀区中宁路,上海市普陀区远景路518号
924124,121.535,31.288,121.544,31.293000000000003,上海市杨浦区沧州路57号,上海市杨浦区水丰路201号甲
311186,121.448,31.315,121.448,31.316,上海市闸北区三泉路424弄,上海市闸北区三泉路517弄
348982,121.414,31.269000000000002,121.42399999999999,31.273000000000003,上海市普陀区富平路727弄-1-～22号,上海市宝山区新村路
1319364,121.397,31.299,121.416,31.299,上海市普陀区祁顺路,上海市宝山区真大路485弄31号
197200,121.495,31.136,121.5,31.136,上海市浦东新区济阳路跨线桥,上海市浦东新区济阳路跨线桥
1155941,121.432,31.215,121.435,31.211,上海市长宁区延安西路1328弄-1-～8号,上海市长宁区番禺路338号
1762359,121.34299999999999,31.253,121.355,31.241999999999997,上海市嘉定区发祥路68弄-8-临,上海市长宁区广顺北路
1204860,121.531,31.323,121.544,31.329,上海市杨浦区国和路,上海市杨浦区包头路717号
1430781,121.51799999999999,31.274,121.542,31.273000000000003,上海市杨浦区辽源西路111号,上海市杨浦区宁国路438弄-2号
1737256,121.49600000000001,31.265,121.49799999999999,31.265,上海市虹口区天水路196号,上海市虹口区天水路88号
816745,121.48100000000001,31.34,121.49,31.337,上海市宝山区新二路1242号,上海市宝山区求安路
976805,121.477,31.211,121.48200000000001,31.21,上海市黄浦区打浦路1-4-临,上海市黄浦区南塘浜路36号
1353423,121.507,31.271,121.516,31.274,上海市虹口区瑞虹路351号,上海市杨浦区辽源西路209号
1343974,121.537,31.283,121.553,31.28,上海市杨浦区源泉路79弄-6号,上海市杨浦区河间路1157号
1796617,121.38799999999999,31.21,121.49,31.241999999999997,上海市长宁区仙霞路1088弄-118-～126号,上海市黄浦区九江路350号
353368,121.39299999999999,31.163,121.396,31.165,上海市闵行区漕宝路1427号,上海市闵行区漕宝路
356032,121.396,31.141,121.40700000000001,31.129,上海市闵行区平阳路692号,上海市闵行区梅陇西路980号
462158,121.416,31.219,121.428,31.218000000000004,上海市长宁区玉屏南路199弄103室,上海市长宁区昭化路555弄265-270号
666486,121.421,31.254,121.432,31.250999999999998,上海市普陀区中宁路176号7-8层,上海市普陀区中山北路2380号-108室
223285,121.40799999999999,31.276,121.42200000000001,31.274,上海市普陀区新村路2003弄16号,上海市宝山区大华路211号
1273850,121.368,31.156999999999996,121.381,31.156999999999996,上海市闵行区新镇路995号,上海市闵行区星环路8号楼-102号
1688717,121.49,31.226999999999997,121.49,31.228,上海市黄浦区方浜西路49号,上海市黄浦区人民路1018号
1330327,121.402,31.241,121.41,31.241999999999997,上海市普陀区怒江北路193号,上海市普陀区枣阳路205号
1560820,121.506,31.315,121.51,31.316999999999997,上海市杨浦区政立路669弄-9号,上海市杨浦区政立路511号
816957,121.48,31.205,121.485,31.206,上海市黄浦区瞿溪路1111弄26号,上海市黄浦区瞿溪路927号
959716,121.42399999999999,31.278000000000002,121.45,31.274,上海市宝山区新沪路837弄-8幢,上海市闸北区沪太路807弄-1号-东
586351,121.46600000000001,31.26,121.46799999999999,31.256,上海市闸北区中华新路727弄,上海市闸北区太阳山路103号
1526188,121.375,31.345,121.387,31.351,上海市宝山区陈富路,上海市宝山区陈富路272号
459467,121.37299999999999,31.320999999999998,121.376,31.316999999999997,上海市宝山区S20(环西二大道),上海市宝山区丰宝路
1117554,121.41799999999999,31.272,121.42299999999999,31.273000000000003,上海市普陀区富平路509号,上海市宝山区大华路
1260787,121.44,31.320999999999998,121.446,31.32,上海市宝山区康宁路,上海市闸北区三泉路
1025038,121.425,31.337,121.432,31.333000000000002,上海市宝山区大陈路52号,上海市宝山区大康路800号-临
721056,121.416,31.253,121.428,31.256999999999998,上海市普陀区曹杨路1246,上海市普陀区兰田路
700110,121.525,31.293000000000003,121.53399999999999,31.299,上海市杨浦区五角场政仁路22号,上海市杨浦区双阳北路
1395300,121.436,31.234,121.44,31.23,上海市静安区万航渡路782号,上海市长宁区镇宁路545弄-61号
484383,121.478,31.409000000000002,121.484,31.408,上海市宝山区盘古路,上海市宝山区同济路973号-临
1234548,121.382,31.27,121.397,31.26,上海市普陀区祁连山南路3401号,上海市普陀区真北路2195-1号
359294,121.352,31.129,121.36200000000001,31.131,上海市松江区顾戴路,上海市闵行区友东路
1285548,121.45100000000001,31.215999999999998,121.461,31.224,上海市徐汇区永福路127号,上海市徐汇区新乐路92号
1364055,121.43299999999999,31.396,121.48,31.401,上海市宝山区S127(湄浦河桥),上海市宝山区宝杨路1369号通道
436191,121.45299999999999,31.31,121.45700000000001,31.313000000000002,上海市闸北区新泉路,上海市闸北区场中路2107弄
803807,121.479,31.269000000000002,121.479,31.27,上海市闸北区青云路360号,上海市闸北区青云路321号-乙
1314620,121.48899999999999,31.264,121.49799999999999,31.261,上海市虹口区四川北路1717号-5-f,上海市虹口区柘皋路204号
1093456,121.499,31.127,121.522,31.125,上海市浦东新区红临路,上海市浦东新区林恒路818弄-151号
1044841,121.32600000000001,31.239,121.346,31.259,上海市嘉定区爱特路97号,上海市嘉定区华江公路187号
856312,121.417,31.217,121.425,31.205,上海市长宁区天山路,上海市长宁区安顺路181弄
1409550,121.475,31.201,121.48700000000001,31.208000000000002,上海市徐汇区茶陵路65弄,上海市黄浦区局门路434弄-18号
1516159,121.461,31.198,121.46700000000001,31.206,上海市徐汇区东安路273号,上海市徐汇区清真路33号
398316,121.53200000000001,31.320999999999998,121.539,31.320999999999998,上海市杨浦区嫩江路2502,上海市杨浦区嫩江路1248
1778633,121.51799999999999,31.209,121.525,31.211,上海市浦东新区浦东南路2304号208室,上海市浦东新区临沂北路200号
75810,121.41,31.168000000000003,121.435,31.162,上海市徐汇区漕宝路688-12号,上海市徐汇区动力北一路
1695851,121.37299999999999,31.182,121.434,31.211,上海市闵行区青衫路167,上海市长宁区法华镇路451号
705327,121.405,31.219,121.415,31.218000000000004,上海市长宁区天山支路39弄,上海市长宁区遵义路410号
557625,121.47,31.201,121.48,31.2,上海市徐汇区大木桥路499号,上海市黄浦区龙华东路749号
1691356,121.512,31.271,121.52600000000001,31.276999999999997,上海市虹口区三河路4号,上海市杨浦区江浦路1289
150765,121.40799999999999,31.29,121.417,31.291999999999998,上海市普陀区真北路3725弄15号,上海市宝山区行知路638弄-33号
130019,121.321,31.296,121.322,31.298000000000002,上海市嘉定区古猗园路281弄-2号,上海市嘉定区古猗园路
565428,121.359,31.22,121.368,31.229,上海市长宁区北祥路2号,上海市长宁区淞虹路86号
1403333,121.427,31.234,121.443,31.241999999999997,上海市普陀区隆德路153号,上海市静安区安远路681号-、685号
828637,121.431,31.261,121.432,31.261999999999997,上海市普陀区管弄路290号,上海市普陀区华池路162号
1214260,121.444,31.215,121.46,31.22,上海市徐汇区湖南路376号,上海市徐汇区淮海中路1181号
167396,121.38,31.221,121.399,31.215999999999998,上海市长宁区新渔路122号-临,上海市长宁区茅台路500弄1-14号
389716,121.40899999999999,31.166,121.412,31.164,上海市闵行区虹梅路1123号-3,上海市徐汇区虹梅路1150-3
1424169,121.45299999999999,31.267,121.47200000000001,31.252,上海市普陀区华阴路76号,上海市闸北区新马路
1519204,121.38600000000001,31.315,121.389,31.319000000000003,上海市宝山区X126(丰翔路),上海市宝山区祁连山路2601号
1360115,121.48100000000001,31.3,121.488,31.314,上海市虹口区车站南路407弄-6幢,上海市虹口区场中路187号
818687,121.501,31.274,121.515,31.274,上海市虹口区四平路510号,上海市杨浦区辽源西路209号200098
216592,121.523,31.281,121.527,31.276,上海市杨浦区控江路1672号,上海市杨浦区江浦路1232号
778568,121.479,31.338,121.488,31.338,上海市宝山区通南路328弄-5号,上海市宝山区一二八纪念东路
1598153,121.54899999999999,31.307,121.551,31.309,上海市杨浦区佳木斯路64号,上海市杨浦区军工路1203-2号
809571,121.336,31.159000000000002,121.348,31.156,上海市松江区嘉闵高架路,上海市闵行区沪松公路577号5楼
1590134,121.478,31.338,121.484,31.335,上海市宝山区通南路328弄-7号,上海市宝山区一二八纪念东路
1666881,121.40899999999999,31.311999999999998,121.411,31.311,上海市宝山区环镇北路600弄158,上海市宝山区
