orderid,first_x,first_y,last_x,last_y,start_loc,end_loc
1724563,121.49,31.316,121.495,31.323,上海市虹口区三门路,上海市宝山区逸仙路1321弄-3支弄-46号
1327640,121.363,31.22,121.365,31.221999999999998,上海市长宁区协和路590号,上海市长宁区福泉路145号
1311660,121.488,31.331999999999997,121.494,31.339000000000002,上海市宝山区求真路,上海市宝山区长江南路201号
1292174,121.46600000000001,31.23,121.486,31.212,上海市静安区延安中路537号,上海市黄浦区丽园路710弄-6号
329610,121.449,31.307,121.465,31.31,上海市闸北区新泉路,上海市闸北区场中路
361654,121.434,31.115,121.446,31.118000000000002,上海市闵行区普乐路,上海市闵行区曹联路88号
953537,121.427,31.163,121.428,31.165,上海市徐汇区桂林东街277号,上海市徐汇区钦州南路404号
817405,121.441,31.331,121.46,31.331,上海市宝山区长临路976号,上海市宝山区岭南路1289弄-16号
771034,121.45700000000001,31.336,121.465,31.337,上海市宝山区共江路889号,上海市宝山区共江路92号
1166251,121.506,31.328000000000003,121.516,31.326,上海市杨浦区国泓路,上海市杨浦区殷高东路
1538810,121.419,31.291999999999998,121.47399999999999,31.304000000000002,上海市宝山区行知路572弄-64号,上海市虹口区广粤路741号
1603337,121.48200000000001,31.268,121.49600000000001,31.275,上海市闸北区东宝兴路720号,上海市虹口区欧阳路
1584691,121.471,31.32,121.485,31.32,上海市闸北区汾西路166号,上海市虹口区安汾路302号
493221,121.339,31.149,121.34700000000001,31.138,上海市松江区涞亭南路95号,上海市松江区淀浦河路
1730204,121.415,31.272,121.42200000000001,31.281,上海市普陀区富平路647号,上海市宝山区大华路869弄-35号
1390558,121.421,31.276999999999997,121.431,31.294,上海市宝山区大华路388号,上海市闸北区汶水路940号
1354911,121.448,31.096999999999998,121.45700000000001,31.092,上海市闵行区双柏路,上海市闵行区
1602067,121.39,31.307,121.391,31.307,上海市宝山区南大路,上海市宝山区南大路
363828,121.45200000000001,31.201999999999998,121.455,31.197,上海市徐汇区宛平南路71号,上海市徐汇区宛平南路431弄-1号
603044,121.488,31.155,121.53200000000001,31.149,上海市浦东新区高青西路,上海市浦东新区永泰路1205
1347833,121.445,31.165,121.45299999999999,31.17,上海市徐汇区石龙支路,上海市徐汇区龙吴路293号
244228,121.426,31.33,121.43700000000001,31.326,上海市宝山区,上海市宝山区刘场路441号
381554,121.436,31.182,121.444,31.18,上海市徐汇区钦州路639号25室,上海市徐汇区漕东路200号
1070608,121.486,31.29,121.49,31.294,上海市虹口区广灵一路157-2号-临,上海市虹口区中山北一路865弄-14号-东103室
50806,121.43799999999999,31.31,121.441,31.31,上海市闸北区场中路3308号,上海市闸北区场中路3222号
1601643,121.40799999999999,31.283,121.42,31.275,上海市普陀区武威东路,上海市普陀区大华一路
1153648,121.416,31.215999999999998,121.427,31.186999999999998,上海市长宁区天山路1669号,上海市徐汇区钦州北路188号
1709961,121.406,31.252,121.411,31.254,上海市普陀区羊肠浜,上海市普陀区糖坊街32号
178688,121.536,31.256,121.54799999999999,31.269000000000002,上海市杨浦区安浦路,上海市杨浦区杭州路490号
547822,121.396,31.244,121.411,31.245,上海市普陀区梅川路999弄-43号,上海市普陀区桂巷路51号
1258144,121.53200000000001,31.264,121.545,31.272,上海市杨浦区平凉路694号,上海市杨浦区锦州湾路122号
1207709,121.35700000000001,31.241,121.383,31.232,上海市长宁区协和路,上海市普陀区真北路333
821332,121.531,31.315,121.54,31.318,上海市杨浦区长海路276号,上海市杨浦区民星路600弄-12号
1403078,121.387,31.283,121.39299999999999,31.271,上海市普陀区武威路8号,上海市普陀区绥德路2弄-36
422513,121.527,31.324,121.53200000000001,31.322,上海市杨浦区民庆路212号,上海市杨浦区世界路15弄
924270,121.525,31.309,121.538,31.311,上海市杨浦区政益路8-～28号,上海市杨浦区营口路1041号
218425,121.404,31.239,121.41,31.241999999999997,上海市普陀区金沙江路856号,上海市普陀区枣阳路205号
1797138,121.43700000000001,31.269000000000002,121.444,31.265,上海市普陀区志丹路151号,上海市普陀区洛川路292号
691062,121.40100000000001,31.276,121.42299999999999,31.278000000000002,上海市普陀区真北路3128号,上海市宝山区新沪路837弄-27号
608652,121.492,31.308000000000003,121.525,31.281,上海市虹口区五角场万安路261号,上海市杨浦区江浦路1493号
1303999,121.48200000000001,31.256,121.491,31.27,上海市闸北区天目东路206号201室,上海市虹口区四川北路2002号
189662,121.633,31.239,121.65700000000001,31.236,上海市浦东新区X574(申江路),上海市浦东新区
192495,121.521,31.266,121.535,31.27,上海市杨浦区荆州路272号,上海市杨浦区兰州路851号
303385,121.56200000000001,31.272,121.56200000000001,31.275,上海市杨浦区腾越路,上海市杨浦区腾越路
956991,121.54899999999999,31.289,121.557,31.281999999999996,上海市杨浦区水丰路134号,上海市杨浦区内江路81号
1767218,121.49700000000001,31.263,121.5,31.261999999999997,上海市虹口区哈尔滨路291号,上海市虹口区梧州路348号
1709446,121.45700000000001,31.279,121.473,31.278000000000002,上海市闸北区大宁路540弄-35号,上海市闸北区北宝兴路96号
1454731,121.405,31.273000000000003,121.406,31.276999999999997,上海市普陀区真南路,上海市普陀区万泉路51
1185737,121.494,31.336,121.49700000000001,31.338,上海市宝山区逸仙路辅路,上海市宝山区长江南路59号
1691684,121.45,31.226999999999997,121.45299999999999,31.234,上海市静安区延安西路65号1楼,上海市静安区常德路371号
815519,121.294,31.268,121.315,31.273000000000003,上海市嘉定区浦环路16号,上海市嘉定区曹安公路辅路
47684,121.529,31.273000000000003,121.53299999999999,31.268,上海市杨浦区昆明路1205,上海市杨浦区济宁路352号
303860,121.486,31.228,121.491,31.219,上海市黄浦区崇德路40弄-23号,上海市黄浦区大吉路200-、208号
1543015,121.469,31.253,121.47200000000001,31.258000000000003,上海市闸北区共和新路288号,上海市闸北区中兴路1066号-15-16号
596648,121.471,31.199,121.47399999999999,31.195,上海市徐汇区大木桥路625,上海市徐汇区龙华中路
844288,121.48200000000001,31.258000000000003,121.507,31.254,上海市闸北区虬江路888弄,上海市虹口区东大名路578
197005,121.476,31.252,121.48,31.246,上海市闸北区天目中路246号,上海市黄浦区西藏中路728号710室
1265258,121.416,31.215,121.443,31.206999999999997,上海市长宁区天山路1761弄-18号,上海市徐汇区华山路1783
1469594,121.375,31.184,121.38600000000001,31.173000000000002,上海市闵行区白樟路222号,上海市闵行区龙茗路3006号
1444835,121.41,31.416999999999998,121.42399999999999,31.395,上海市宝山区园和路,上海市宝山区杨宗路128号
1725173,121.384,31.26,121.4,31.261999999999997,上海市嘉定区铜川路2235号,上海市普陀区真北支路78号
1631116,121.49,31.28,121.49700000000001,31.29,上海市虹口区大连西路855号,上海市虹口区曲阳路651号
545851,121.507,31.285,121.51700000000001,31.284000000000002,上海市杨浦区赤峰路63-2号,上海市杨浦区抚顺路364号
1544477,121.47399999999999,31.283,121.478,31.285999999999998,上海市虹口区新同心路215号,上海市虹口区广中路373号
559661,121.506,31.329,121.51,31.335,上海市杨浦区国泓路,上海市杨浦区殷行路
1258485,121.492,31.18,121.53399999999999,31.186,上海市浦东新区耀华路372号,上海市浦东新区北艾路1487号
1465943,121.506,31.315,121.514,31.308000000000003,上海市杨浦区政立路669弄-9号,上海市杨浦区政民路230弄4号
870385,121.57700000000001,31.316,121.588,31.311999999999998,上海市浦东新区,上海市浦东新区莱阳路
1694208,121.53200000000001,31.319000000000003,121.53200000000001,31.324,上海市杨浦区恒仁路,上海市杨浦区国和路983号
1684479,121.43700000000001,31.185,121.45,31.186,上海市徐汇区华石路,上海市徐汇区中山南二路1089号-10楼
626522,121.354,31.165,121.35700000000001,31.163,上海市闵行区七莘路3178号,上海市闵行区吴宝路7
1434477,121.494,31.343000000000004,121.495,31.346,上海市宝山区长逸路388弄-30号,上海市宝山区淞良路188号
1500819,121.42299999999999,31.22,121.427,31.226999999999997,上海市长宁区武夷路709弄26号,上海市长宁区长宁路780号0
1049170,121.368,31.171,121.42200000000001,31.081999999999997,上海市闵行区号上路,上海市闵行区都会路2547号
908471,121.48,31.258000000000003,121.495,31.25,上海市闸北区虬江路1009-1,上海市虹口区北苏州路111号
475957,121.446,31.127,121.456,31.127,上海市徐汇区老沪闵路1296弄-6-3,上海市徐汇区长华路477号
1692664,121.531,31.311999999999998,121.538,31.314,上海市杨浦区政通路260弄8号,上海市杨浦区中原路57号
1766275,121.324,31.245,121.338,31.254,上海市嘉定区金园一路1519弄-5号,上海市嘉定区华江路688弄-8号
1236390,121.45299999999999,31.199,121.47399999999999,31.205,上海市徐汇区宛平南路278号,上海市徐汇区茶陵路225弄-10号
215185,121.449,31.166,121.45299999999999,31.17,上海市徐汇区石龙支路,上海市徐汇区龙吴路293号
1483030,121.36399999999999,31.213,121.376,31.206999999999997,上海市长宁区可乐路155号,上海市长宁区剑河路838弄
211044,121.454,31.19,121.46700000000001,31.195,上海市徐汇区中山南二路950弄-10号,上海市徐汇区中山南二路555号403A室
119115,121.432,31.162,121.43700000000001,31.185,上海市徐汇区桂林东街101弄-1号,上海市徐汇区华石路
394911,121.396,31.256,121.404,31.26,上海市普陀区真北路1999弄-47号,上海市普陀区大渡河路1930号
1403014,121.432,31.25,121.459,31.245,上海市普陀区凯旋北路398号,上海市静安区昌平路150号
1248044,121.45,31.256,121.458,31.256,上海市普陀区中潭路33号,上海市闸北区恒丰路787号
448791,121.584,31.245,121.59200000000001,31.244,上海市浦东新区蓝天路368弄,上海市浦东新区蓝桉路234号
1093778,121.365,31.278000000000002,121.367,31.284000000000002,上海市普陀区S20(外环沪宁沪杭铁路立交桥),上海市普陀区武威路875弄-51号
1103111,121.463,31.323,121.47,31.32,上海市闸北区保德路559号,上海市闸北区汾西路260弄-8号
377810,121.495,31.26,121.51100000000001,31.250999999999998,上海市虹口区哈尔滨路61,上海市浦东新区泰公线
420745,121.525,31.281,121.527,31.278000000000002,上海市杨浦区江浦路1493号,上海市杨浦区江浦路1334号
726461,121.456,31.259,121.463,31.271,上海市闸北区交通路1247号,上海市闸北区柳营路717弄-1号
1370428,121.484,31.206999999999997,121.494,31.195999999999998,上海市黄浦区鲁班路509弄-9-1-临,上海市浦东新区
1240774,121.436,31.182,121.446,31.188000000000002,上海市徐汇区钦州路639号25室,上海市徐汇区零陵路800
1700935,121.506,31.261,121.514,31.252,上海市虹口区高阳路475号,上海市浦东新区泰公线
1165893,121.42399999999999,31.279,121.441,31.281999999999996,上海市宝山区大华二路131号,上海市闸北区运城路616号
280207,121.459,31.249000000000002,121.464,31.248,上海市闸北区长安路898号,上海市闸北区恒丰路121号
565026,121.473,31.206,121.477,31.221,上海市徐汇区斜土路1118号,上海市黄浦区重庆南路224号-甲
667564,121.387,31.226,121.39200000000001,31.230999999999998,上海市普陀区丹巴路6号,上海市普陀区泸定路
315534,121.427,31.250999999999998,121.435,31.255,上海市普陀区中山北路2605弄50号,上海市普陀区中山北路2139弄76
28902,121.525,31.326,121.539,31.328000000000003,上海市杨浦区闸殷路1203号,上海市杨浦区中原路414号
713465,121.48299999999999,31.256999999999998,121.516,31.250999999999998,上海市闸北区交通路69号,上海市浦东新区
447118,121.53299999999999,31.2,121.538,31.195999999999998,上海市浦东新区杨高南路1797,上海市浦东新区严中路300弄-5
542491,121.30799999999999,31.285,121.322,31.296,上海市嘉定区翔黄公路,上海市嘉定区沪宜公路237号
185351,121.414,31.271,121.448,31.291999999999998,上海市普陀区富平路713,上海市闸北区万荣路900号
912693,121.469,31.209,121.479,31.226,上海市徐汇区肇嘉浜路249,上海市黄浦区重庆南路139号2楼
936429,121.514,31.284000000000002,121.52,31.3,上海市杨浦区阜新路191号,上海市杨浦区国定路175号
540729,121.41,31.169,121.417,31.171999999999997,上海市徐汇区漕宝路801号,上海市徐汇区虹漕路15号202室
657354,121.37799999999999,31.276999999999997,121.384,31.276999999999997,上海市普陀区真南路1422号,上海市普陀区祁连山南路3232号
1529089,121.493,31.3,121.524,31.285999999999998,上海市虹口区吴家湾路,上海市杨浦区江浦路1602号
400602,121.39399999999999,31.259,121.40100000000001,31.261,上海市普陀区铜川路1780弄-86,上海市普陀区真北支路77
139913,121.48299999999999,31.29,121.494,31.29,上海市虹口区水电路794号,上海市虹口区东体育会路862号
285356,121.531,31.287,121.53399999999999,31.288,上海市杨浦区延吉中路569号,上海市杨浦区延吉中路365号
897731,121.46799999999999,31.197,121.491,31.199,上海市徐汇区小木桥路538弄-1-～2号,上海市黄浦区局门路
185283,121.37799999999999,31.261999999999997,121.384,31.26,上海市嘉定区铜川路2488号,上海市嘉定区铜川路2235号
1601656,121.52600000000001,31.324,121.535,31.328000000000003,上海市杨浦区市光路417号,上海市杨浦区市光路888号
881409,121.43299999999999,31.195,121.495,31.215999999999998,上海市徐汇区徐虹北路8号-1,上海市黄浦区丽园路72号
210730,121.301,31.22,121.304,31.223000000000003,上海市闵行区繁兴路300弄-160号,上海市闵行区北青公路699弄10号
1752485,121.492,31.281,121.507,31.285999999999998,上海市虹口区欧阳路678号,上海市杨浦区赤峰路65号3楼
1536827,121.485,31.397,121.495,31.384,上海市宝山区,上海市宝山区同济路辅路
177432,121.428,31.288,121.449,31.291999999999998,上海市宝山区新沪路1289号,上海市闸北区万荣路897号
1153709,121.484,31.304000000000002,121.486,31.303,上海市虹口区水电路1381弄-23号,上海市虹口区车站北路162号
1757707,121.441,31.336,121.46600000000001,31.337,上海市宝山区长临路,上海市宝山区虎林路111号
1145749,121.48899999999999,31.21,121.493,31.213,上海市黄浦区局门路405弄,上海市黄浦区斜土东路294号
1021254,121.417,31.188000000000002,121.435,31.201999999999998,上海市闵行区钦州北路,上海市徐汇区番禺路951号
34220,121.402,31.264,121.406,31.276999999999997,上海市普陀区真北支路263弄-4号,上海市普陀区万泉路51
1376344,121.475,31.183000000000003,121.493,31.186,上海市浦东新区世博大道,上海市浦东新区国展路
961760,121.479,31.308000000000003,121.485,31.307,上海市虹口区万安路979弄-19号,上海市虹口区万安路669弄-18号
707723,121.404,31.211,121.414,31.217,上海市长宁区仙霞路350号5号楼,上海市长宁区天山路980号
1342228,121.381,31.224,121.38799999999999,31.24,上海市长宁区蒲淞北路51,上海市普陀区金沙江路1698弄2-9号
1666869,121.524,31.328000000000003,121.53200000000001,31.328000000000003,上海市杨浦区闸殷路,上海市杨浦区民京路959号
1525323,121.37700000000001,31.263,121.381,31.263,上海市嘉定区金鼎路,上海市嘉定区祁连山南路2574号
578932,121.38600000000001,31.171,121.391,31.168000000000003,上海市闵行区漕宝路1555弄-15区-1号-商铺-105,上海市闵行区田林路1322号
19977,121.412,31.271,121.42299999999999,31.273000000000003,上海市普陀区真金路162号,上海市宝山区大华路
723124,121.539,31.3,121.545,31.291999999999998,上海市杨浦区佳木斯路,上海市杨浦区延吉东路559号-6
1615808,121.319,31.305,121.321,31.304000000000002,上海市嘉定区古猗园路658弄-11号,上海市嘉定区德方路
866620,121.448,31.325,121.46,31.331,上海市闸北区三泉路999号,上海市宝山区岭南路1289弄-16号
1188004,121.39,31.259,121.4,31.261,上海市普陀区铜川路1953号,上海市普陀区真北支路45号
349880,121.45100000000001,31.26,121.458,31.254,上海市普陀区中潭路100弄-60,上海市闸北区恒丰路610号-4号楼-1楼
1209672,121.45299999999999,31.234,121.459,31.23,上海市静安区常德路371号,上海市静安区延安中路1000
1533554,121.506,31.195999999999998,121.508,31.198,上海市浦东新区连云港路1号,上海市浦东新区世博大道
787728,121.396,31.322,121.397,31.322,上海市宝山区上大路99号,上海市宝山区泮池北路
356180,121.51799999999999,31.288,121.541,31.298000000000002,上海市杨浦区彰武路113号,上海市杨浦区松花江路287号-1
749202,121.48,31.307,121.49,31.291999999999998,上海市虹口区华严路10号-临,上海市虹口区中山北一路801号
158895,121.51899999999999,31.32,121.52,31.32,上海市杨浦区闸殷路1945号,上海市杨浦区民京路160号
1171370,121.396,31.188000000000002,121.419,31.203000000000003,上海市闵行区虹梅路3005,上海市长宁区虹桥路1053弄-1号
900553,121.53200000000001,31.28,121.535,31.278000000000002,上海市杨浦区凤城路5-11号-临,上海市杨浦区九潭路
1623688,121.43299999999999,31.195999999999998,121.44200000000001,31.191999999999997,上海市徐汇区徐虹北路3号A,上海市徐汇区蒲汇塘路18-1号-临
21145,121.539,31.289,121.54299999999999,31.285999999999998,上海市杨浦区永吉路182号,上海市杨浦区双阳路369号
523622,121.44200000000001,31.296999999999997,121.45,31.295,上海市闸北区汶水路405号,上海市闸北区永和路318弄-10
1022407,121.411,31.136999999999997,121.413,31.141,上海市闵行区梅陇西路522号,上海市闵行区沪闵路7897号
168050,121.383,31.144000000000002,121.391,31.142,上海市闵行区外环顾戴路立交桥,上海市闵行区顾戴路
648535,121.53399999999999,31.184,121.539,31.178,上海市浦东新区华春路180,上海市浦东新区新浦路
1429019,121.417,31.206999999999997,121.425,31.205,上海市长宁区安顺路334,上海市长宁区安顺路181弄
311670,121.44,31.226,121.45299999999999,31.234,上海市长宁区愚园路818号,上海市静安区常德路371号
158191,121.419,31.355999999999998,121.435,31.397,上海市宝山区X110(泰和西路),上海市宝山区月城路
1000986,121.432,31.115,121.446,31.118000000000002,上海市闵行区兴梅路575,上海市闵行区曹联路88号
489650,121.417,31.213,121.42399999999999,31.205,上海市长宁区紫云路309号,上海市长宁区长顺路57号
1068877,121.365,31.249000000000002,121.381,31.243000000000002,上海市嘉定区新郁路180号,上海市普陀区清峪路81弄-85号
79944,121.37100000000001,31.320999999999998,121.37299999999999,31.322,上海市宝山区S20(环西二大道),上海市宝山区锦秋路2128号
279515,121.48200000000001,31.264,121.48899999999999,31.26,上海市闸北区中兴路405号,上海市虹口区新广路128号
536949,121.444,31.337,121.45299999999999,31.33,上海市宝山区三泉路1852,上海市宝山区一二八纪念路1100号-c5-c6座
378169,121.561,31.283,121.56200000000001,31.283,上海市杨浦区定海路452号,上海市杨浦区平凉路2678号
579965,121.506,31.264,121.512,31.258000000000003,上海市虹口区岳州路160号,上海市虹口区公平路233号
594612,121.36,31.182,121.402,31.184,上海市闵行区航东路528弄89号1层,上海市闵行区虹梅路2806弄
1137401,121.501,31.274,121.53200000000001,31.271,上海市虹口区四平路510号,上海市杨浦区齐齐哈尔路839号
1752550,121.45299999999999,31.223000000000003,121.456,31.224,上海市静安区常熟路100弄1-10号,上海市静安区常熟路113弄17号
1452790,121.399,31.209,121.404,31.21,上海市长宁区虹古路261弄-16号,上海市长宁区虹古路106号
731048,121.448,31.311999999999998,121.459,31.326999999999998,上海市闸北区三泉路260号,上海市宝山区共和新路4699弄1-30号
1614856,121.385,31.206,121.389,31.203000000000003,上海市长宁区龙溪路,上海市长宁区龙溪路
1087753,121.444,31.264,121.459,31.26,上海市普陀区交通路1941-1953弄,上海市闸北区恒丰北路47号
556539,121.538,31.276,121.542,31.276,上海市杨浦区眉州支路77号,上海市杨浦区长阳路1670
59485,121.465,31.275,121.477,31.27,上海市闸北区洛川东路487号,上海市闸北区宝昌路738弄
955003,121.42299999999999,31.289,121.431,31.29,上海市宝山区大华路1288,上海市闸北区阳城路283弄-78号
1063207,121.4,31.066999999999997,121.40899999999999,31.055,上海市闵行区繁安路,上海市闵行区元江路3338
1020626,121.53200000000001,31.269000000000002,121.536,31.264,上海市杨浦区霍山路1058号-1,上海市杨浦区扬州路588弄-21号
1658666,121.381,31.219,121.421,31.224,上海市长宁区哈密路371号,上海市长宁区长宁路1188弄-2-11号
445908,121.473,31.221,121.49700000000001,31.214000000000002,上海市黄浦区复兴中路563,上海市黄浦区斜土东路64号
1618932,121.464,31.318,121.475,31.320999999999998,上海市闸北区安业路46号,上海市虹口区江杨南路359号
449855,121.31700000000001,31.311,121.32600000000001,31.3,上海市嘉定区瑞林路,上海市嘉定区沪宜公路2199弄9-10号
112789,121.334,31.226,121.35799999999999,31.22,上海市闵行区吴漕路1025,上海市长宁区北祥路2号
1308341,121.40700000000001,31.299,121.428,31.293000000000003,上海市宝山区真大路,上海市宝山区沪太路1717号
962280,121.53200000000001,31.320999999999998,121.539,31.320999999999998,上海市杨浦区嫩江路2502,上海市杨浦区嫩江路1248
14312,121.42200000000001,31.284000000000002,121.428,31.276,上海市宝山区大华路1001号,上海市宝山区南华苑路111
1120320,121.54899999999999,31.289,121.556,31.291999999999998,上海市杨浦区水丰路134号,上海市杨浦区图们路
1047710,121.404,31.164,121.411,31.166999999999998,上海市闵行区东兰路320号-c-61号,上海市徐汇区虹梅路1488-10号-临
42625,121.415,31.276999999999997,121.416,31.281999999999996,上海市普陀区真华路,上海市宝山区武威东路72号
356739,121.509,31.281,121.542,31.285999999999998,上海市杨浦区四平路980弄,上海市杨浦区辽源东路
1532219,121.295,31.271,121.305,31.275,上海市嘉定区浦环路3,上海市嘉定区吴杨路50号
1065885,121.426,31.284000000000002,121.441,31.291,上海市宝山区新沪路,上海市闸北区晋城路8号
687606,121.411,31.176,121.419,31.176,上海市徐汇区宜山路889号-4号楼-2层,上海市徐汇区田林路140号-15号楼-1楼
1771887,121.41799999999999,31.302,121.46,31.305999999999997,上海市宝山区真大路,上海市闸北区江场路1391
1598464,121.323,31.244,121.36,31.244,上海市嘉定区鹤旋路155弄,上海市嘉定区福泉北路
1275345,121.48200000000001,31.281999999999996,121.494,31.281999999999996,上海市虹口区水店路365号,上海市虹口区大连西路261-2-临
1640408,121.38600000000001,31.291,121.39,31.294,上海市普陀区祁连山路868号,上海市普陀区S5(沪嘉高速)
8727,121.30799999999999,31.244,121.32,31.24,上海市嘉定区,上海市嘉定区金园一路
803335,121.429,31.259,121.445,31.250999999999998,上海市普陀区岚皋路308-临,上海市普陀区澳门路585号
714925,121.478,31.27,121.494,31.3,上海市闸北区宝昌路737号,上海市虹口区大柏树立交桥
1492623,121.406,31.276,121.432,31.250999999999998,上海市普陀区新村路2099号,上海市普陀区中山北路2380号-108室
241657,121.486,31.209,121.495,31.215,上海市黄浦区五里桥路264号,上海市黄浦区徽宁路407号
1308257,121.461,31.174,121.47,31.191,上海市徐汇区丰谷路255,上海市徐汇区瑞宁路
1064691,121.54299999999999,31.274,121.54700000000001,31.27,上海市杨浦区宁国路438弄-14号,上海市杨浦区三星路55号
1751781,121.59899999999999,31.271,121.604,31.279,上海市浦东新区博兴路914号,上海市浦东新区五莲路1188号
900115,121.458,31.279,121.464,31.274,上海市闸北区大宁路540弄-36号,上海市闸北区洛川中路532号
1215450,121.475,31.201,121.48,31.2,上海市徐汇区茶陵路65弄,上海市黄浦区龙华东路749号
497621,121.419,31.288,121.431,31.289,上海市宝山区行知路399弄,上海市闸北区阳城路283弄-89号
698876,121.402,31.264,121.411,31.289,上海市普陀区真北支路263弄-4号,上海市宝山区真金路1039弄-46号
961443,121.413,31.244,121.415,31.246,上海市普陀区兰溪路119-2,上海市普陀区枫桥路66
771731,121.475,31.294,121.478,31.296999999999997,上海市虹口区凉城路465弄-28号,上海市虹口区凉城路520号
1246960,121.478,31.234,121.479,31.235,上海市黄浦区人民大道339号,上海市黄浦区人民大道242号
1291950,121.53200000000001,31.314,121.539,31.314,上海市杨浦区政立路6弄-27号,上海市杨浦区中原路28弄-1幢
662865,121.431,31.226999999999997,121.45,31.223000000000003,上海市长宁区长宁路575号,上海市静安区乌鲁木齐中路1号1001
281194,121.43799999999999,31.236,121.44200000000001,31.230999999999998,上海市静安区康定路1556号,上海市静安区镇宁路532号
1442875,121.413,31.276,121.431,31.247,上海市普陀区新村路1759弄-23-25号,上海市普陀区东新路230弄-20号
1782781,121.48200000000001,31.34,121.486,31.346999999999998,上海市宝山区新二路1251,上海市宝山区长江南路956号
