orderid,first_x,first_y,last_x,last_y,start_loc,end_loc
582224,121.501,31.279,121.514,31.278000000000002,上海市虹口区天宝西路242弄-19号,上海市杨浦区控江路2200-2204号
498969,121.46600000000001,31.203000000000003,121.476,31.2,上海市徐汇区斜土路1530号,上海市徐汇区中山南二路945弄
635550,121.44200000000001,31.278000000000002,121.443,31.279,上海市闸北区沪太路903弄-3号,上海市闸北区沪太路903弄-17号
247344,121.49,31.263,121.50200000000001,31.265,上海市虹口区东宝兴路272号,上海市虹口区物华路60号
443460,121.42399999999999,31.19,121.43700000000001,31.185,上海市徐汇区古井路,上海市徐汇区华石路
1183198,121.47200000000001,31.283,121.48100000000001,31.281999999999996,上海市虹口区株洲路238号,上海市虹口区水电路302-1号-临
770032,121.495,31.264,121.515,31.3,上海市虹口区海伦路474号,上海市杨浦区政修路10号
767105,121.446,31.338,121.447,31.339000000000002,上海市宝山区纪蕰路,上海市宝山区纪蕴路88号
474672,121.38799999999999,31.26,121.402,31.261,上海市普陀区铜川路2060弄1-156号,上海市普陀区金鼎路
1150219,121.443,31.369,121.448,31.364,上海市宝山区水产路2800号,上海市宝山区泰和路1918号
241882,121.524,31.264,121.529,31.267,上海市杨浦区辽阳路51弄-22号,上海市杨浦区许昌路768弄
1326092,121.43299999999999,31.326999999999998,121.458,31.336,上海市宝山区共康路965号,上海市宝山区共江路842号
1748443,121.529,31.274,121.535,31.27,上海市杨浦区江浦路1094号,上海市杨浦区兰州路851号
467977,121.336,31.265,121.34200000000001,31.26,上海市嘉定区临夏路800弄-9号,上海市嘉定区靖远路729弄-33号
1103945,121.427,31.293000000000003,121.441,31.296999999999997,上海市宝山区沪太路1689号,上海市闸北区汶水路四七九弄1
874346,121.492,31.32,121.506,31.320999999999998,上海市虹口区逸仙路1211-8号,上海市杨浦区民府路
258725,121.384,31.111,121.39200000000001,31.12,上海市闵行区莘浜路178号,上海市闵行区碧秀路60/64号
235812,121.34700000000001,31.154,121.382,31.159000000000002,上海市闵行区中春路7768号,上海市闵行区星虹街1幢-7-15号
164959,121.53200000000001,31.329,121.535,31.331,上海市杨浦区世界路141号,上海市杨浦区开鲁路496-10号-临
1232365,121.509,31.281,121.54799999999999,31.289,上海市杨浦区四平路980弄,上海市杨浦区水丰路153号
359845,121.40299999999999,31.215,121.413,31.195999999999998,上海市长宁区茅台路359号,上海市闵行区红松东路
344915,121.32,31.3,121.322,31.299,上海市嘉定区和平街106号,上海市嘉定区民主东街151弄-5号
1672179,121.459,31.205,121.46600000000001,31.215,上海市徐汇区医学院路135弄-1号,上海市徐汇区嘉善路208号
626599,121.512,31.258000000000003,121.516,31.26,上海市虹口区公平路233号,上海市虹口区舟山路71-临
767782,121.506,31.301,121.507,31.3,上海市杨浦区邯郸路176号,上海市虹口区邯郸路173号1-111
279165,121.55,31.206,121.551,31.209,上海市浦东新区锦安东路418,上海市浦东新区浦建路1458弄1号101室
18399,121.381,31.232,121.38600000000001,31.226999999999997,上海市普陀区云岭西路128号,上海市普陀区丹巴路33号
1563309,121.53200000000001,31.326999999999998,121.539,31.328000000000003,上海市杨浦区世界路125号2层,上海市杨浦区中原路414号
1388474,121.42399999999999,31.186,121.47,31.24,上海市徐汇区钦州北路449,上海市静安区北京西路500号
740411,121.48700000000001,31.226999999999997,121.491,31.23,上海市黄浦区东台路54号,上海市黄浦区青莲街129号
1652259,121.524,31.3,121.529,31.302,上海市杨浦区国定路14号,上海市杨浦区国定东路
741838,121.52799999999999,31.230999999999998,121.55,31.22,上海市浦东新区潍坊路115号,上海市浦东新区X601(锦绣路)
1002221,121.475,31.221,121.48299999999999,31.232,上海市黄浦区复兴中路529号甲,上海市黄浦区普安路50号
347290,121.39299999999999,31.188000000000002,121.413,31.191,上海市闵行区莲花路,上海市闵行区吴中路474号
606354,121.50200000000001,31.291,121.509,31.296999999999997,上海市虹口区中山北二路1515号-c段-103-～106室,上海市杨浦区国权后路
939828,121.50399999999999,31.285999999999998,121.531,31.288,上海市杨浦区密云路,上海市杨浦区延吉中路320弄-12号
1058562,121.369,31.32,121.376,31.316999999999997,上海市宝山区S20(环西二大道),上海市宝山区丰宝路
1228576,121.415,31.269000000000002,121.421,31.265,上海市普陀区富平路657弄-21,上海市普陀区府村路409号
1160354,121.522,31.315,121.536,31.320999999999998,上海市杨浦区市光路31,上海市杨浦区嫩江路1185号新16-17号
1426288,121.524,31.281,121.529,31.283,上海市杨浦区控江路1622号,上海市杨浦区本溪路61/63号
386358,121.37299999999999,31.234,121.38799999999999,31.246,上海市普陀区千阳南路,上海市普陀区真光路
143580,121.53200000000001,31.323,121.53299999999999,31.331,上海市杨浦区世界路51号,上海市杨浦区开鲁路520号
1664104,121.42,31.204,121.445,31.203000000000003,上海市长宁区中山西路1030弄-30号,上海市徐汇区华山路1961号
1601965,121.45700000000001,31.191,121.47,31.195,上海市徐汇区中山南二路861,上海市徐汇区小木桥路700号
706892,121.354,31.166999999999998,121.38,31.177,上海市闵行区吴宝路255号,上海市闵行区吴中路1405号
1536641,121.53200000000001,31.320999999999998,121.538,31.323,上海市杨浦区嫩江路2502,上海市杨浦区中原路169号
181421,121.48299999999999,31.245,121.48899999999999,31.246,上海市黄浦区浙江中路595号,上海市黄浦区北京东路390号
210936,121.397,31.26,121.4,31.261,上海市普陀区真北路2195-1号,上海市普陀区真北支路45号
411241,121.36200000000001,31.357,121.365,31.355,上海市宝山区宝安公路2158号,上海市宝山区宝富路
1556368,121.486,31.209,121.493,31.205,上海市黄浦区五里桥路264号,上海市黄浦区制造局路八三三弄7甲
1718263,121.427,31.344,121.43,31.349,上海市宝山区老富长路,上海市宝山区联谊路580号
15335,121.477,31.223000000000003,121.48200000000001,31.218000000000004,上海市黄浦区重庆南路220弄10号,上海市黄浦区建国东路368号
1615891,121.412,31.139,121.419,31.136,上海市闵行区莲花南路101号,上海市闵行区上中西路925弄-48
747365,121.443,31.156999999999996,121.447,31.156,上海市徐汇区龙川北路788号,上海市徐汇区罗城路
849876,121.545,31.232,121.604,31.234,上海市浦东新区灵山路28号,上海市浦东新区Y172(张家浜路)
138056,121.43700000000001,31.291,121.45,31.291999999999998,上海市闸北区阳城路90号,上海市闸北区万荣路
277426,121.365,31.23,121.367,31.229,上海市长宁区北翟路1010号,上海市长宁区北翟路855号
695554,121.501,31.274,121.507,31.271,上海市虹口区四平路510号,上海市虹口区瑞虹路351号
89350,121.42,31.255,121.471,31.221,上海市普陀区中宁路138弄,上海市黄浦区复兴中路582号
1602641,121.368,31.213,121.38,31.234,上海市长宁区淞虹路805弄-14号,上海市普陀区云岭西路230弄-100号
1146532,121.385,31.355,121.40299999999999,31.35,上海市宝山区沪太路4864号,上海市宝山区沪太路4371号
312962,121.51700000000001,31.276,121.524,31.276,上海市杨浦区打虎山路20号,上海市杨浦区双辽支路70弄35号
1762693,121.522,31.302,121.531,31.305,上海市杨浦区四平路辅路,上海市杨浦区双阳北路395弄-50-1号-临
1180909,121.53399999999999,31.261999999999997,121.542,31.267,上海市杨浦区盐山路174号,上海市杨浦区眉州路297号
922438,121.477,31.275,121.48700000000001,31.276,上海市虹口区黄山路73-6号-临,上海市虹口区东江湾路444号-4区-101-a座
1091664,121.535,31.287,121.541,31.291999999999998,上海市杨浦区永吉路317号,上海市杨浦区营口路7-6
1162925,121.521,31.320999999999998,121.531,31.320999999999998,上海市杨浦区民壮路90号,上海市杨浦区嫩江路2552号-临
325301,121.434,31.237,121.45299999999999,31.229,上海市普陀区长寿路1134号,上海市静安区南京西路1649号
305409,121.365,31.178,121.426,31.188000000000002,上海市闵行区航东路,上海市徐汇区钦州北路
256769,121.484,31.318,121.48700000000001,31.314,上海市虹口区三门路763号,上海市虹口区场中路239弄10-34号
968649,121.415,31.244,121.42,31.24,上海市普陀区兰溪路98号,上海市普陀区凯旋北路
799196,121.45100000000001,31.245,121.462,31.243000000000002,上海市静安区人和街197号,上海市静安区泰兴路625弄-1-14号
1203007,121.435,31.177,121.43700000000001,31.182,上海市徐汇区漕宝路99弄,上海市徐汇区田川路
1670314,121.365,31.176,121.37200000000001,31.169,上海市闵行区航南路199号,上海市闵行区S20(外环高速)
753125,121.37100000000001,31.239,121.376,31.237,上海市普陀区棕榈路,上海市普陀区同普路一二二五弄6号
196601,121.45200000000001,31.174,121.45700000000001,31.173000000000002,上海市徐汇区龙吴路112号,上海市徐汇区龙恒路228号
1214241,121.31299999999999,31.246,121.319,31.241,上海市嘉定区鹤旋路500弄-135号,上海市嘉定区金园一路
708926,121.51100000000001,31.259,121.515,31.263,上海市虹口区东长治路893,上海市虹口区安国路36号
687730,121.48299999999999,31.29,121.48700000000001,31.291,上海市虹口区水电路794号,上海市虹口区广灵一路261号
948115,121.461,31.213,121.47,31.215,上海市徐汇区永嘉路465号,上海市黄浦区绍兴路35号
678887,121.507,31.272,121.51299999999999,31.267,上海市虹口区瑞虹路409号,上海市虹口区周家嘴路1053号
545592,121.443,31.34,121.45,31.328000000000003,上海市宝山区场北路49号,上海市宝山区共康路147号
1363786,121.43700000000001,31.261,121.454,31.271,上海市普陀区光新路309号,上海市闸北区延长中路800弄-79号
614791,121.43700000000001,31.163,121.43799999999999,31.166999999999998,上海市徐汇区柳州路242号,上海市徐汇区沪闵路9118号
1680665,121.381,31.171,121.384,31.166999999999998,上海市闵行区虹莘路3579号-北门,上海市闵行区田林路
863063,121.40700000000001,31.307,121.40799999999999,31.307,上海市宝山区南大路,上海市宝山区南大路162号
1235063,121.384,31.156999999999996,121.391,31.158,上海市闵行区东兰西路121-123号,上海市闵行区东兰路
1065566,121.414,31.285999999999998,121.421,31.279,上海市宝山区华灵路1188号,上海市宝山区大华二路201号
538793,121.43700000000001,31.243000000000002,121.447,31.244,上海市普陀区长寿路792弄-2-～4号,上海市静安区常德路1116号
606905,121.432,31.219,121.46700000000001,31.232,上海市长宁区武夷路258,上海市静安区茂名北路110号
1239310,121.382,31.149,121.387,31.136,上海市闵行区星中路44幢-1号,上海市闵行区S20(外环高速)
664415,121.555,31.283,121.55799999999999,31.279,上海市杨浦区河间路,上海市杨浦区波阳路220号
1242899,121.421,31.253,121.45700000000001,31.186,上海市普陀区中宁路191号,上海市徐汇区华容路101号
1152094,121.449,31.193,121.456,31.191,上海市徐汇区天钥桥路380弄366号,上海市徐汇区中山南二路908号
73345,121.31700000000001,31.309,121.323,31.3,上海市嘉定区S5(沪嘉高速),上海市嘉定区民主东路123号
622654,121.49700000000001,31.271,121.5,31.272,上海市虹口区欧阳路67号,上海市虹口区四平路460号
184761,121.537,31.320999999999998,121.541,31.324,上海市杨浦区中原路99弄-23号,上海市杨浦区国和路1095号
951629,121.41,31.185,121.413,31.191,上海市徐汇区钦州北路1122号-91号楼-6层,上海市闵行区吴中路474号
1465584,121.49,31.273000000000003,121.495,31.269000000000002,上海市虹口区甜爱路92号,上海市虹口区宝安路17号
627491,121.512,31.3,121.521,31.296999999999997,上海市杨浦区国权路580弄61,上海市杨浦区国顺路128弄
1404582,121.45700000000001,31.264,121.46600000000001,31.254,上海市闸北区沪太路567号,上海市闸北区秣陵路39号523室
347380,121.495,31.294,121.51299999999999,31.302,上海市虹口区甘河路178号,上海市杨浦区国年路275弄
1706526,121.368,31.259,121.384,31.25,上海市嘉定区曹安公路1857号,上海市普陀区梅川路1333弄1-372号
1643780,121.48100000000001,31.336,121.49,31.338,上海市宝山区新二路1088弄-45号,上海市宝山区求安路
142244,121.45,31.26,121.458,31.259,上海市普陀区中潭路100弄-86,上海市闸北区恒丰北路1号
1197075,121.366,31.233,121.37,31.232,上海市长宁区通协路,上海市普陀区祁连山南路辅路
1556298,121.509,31.296,121.537,31.301,上海市杨浦区政修路270号,上海市杨浦区国顺东路
749370,121.512,31.261,121.53299999999999,31.236,上海市虹口区唐山路573号,上海市浦东新区张杨路937号
516040,121.48700000000001,31.288,121.49700000000001,31.285,上海市虹口区广灵二路16-7,上海市虹口区玉田路340号
838859,121.435,31.323,121.445,31.324,上海市宝山区大康路319号,上海市闸北区长临路
84633,121.435,31.201,121.445,31.198,上海市徐汇区番禺路955号,上海市徐汇区漕溪北路97-临
1525153,121.41,31.305,121.441,31.311999999999998,上海市宝山区南大路137号,上海市闸北区刘场路15号
414288,121.416,31.174,121.431,31.184,上海市徐汇区田林路191号,上海市徐汇区宜山路661
1752529,121.43799999999999,31.141,121.45,31.156,上海市徐汇区上中西路,上海市徐汇区罗城路
1548557,121.381,31.31,121.38600000000001,31.309,上海市宝山区丰收东路,上海市宝山区祁连山路72弄2号
626162,121.44,31.254,121.448,31.247,上海市普陀区光复西路122号,上海市普陀区西康路1003号
957927,121.42399999999999,31.27,121.43,31.261999999999997,上海市普陀区富平路149号,上海市普陀区管弄路261号
1141162,121.478,31.183000000000003,121.49,31.184,上海市浦东新区国展路,上海市浦东新区打浦路
1384554,121.301,31.308000000000003,121.323,31.3,上海市嘉定区惠亚路8号,上海市嘉定区民主东路123号
1655594,121.448,31.238000000000003,121.45700000000001,31.244,上海市静安区康定路810号,上海市静安区昌平路218号
359827,121.384,31.26,121.402,31.261,上海市嘉定区铜川路2235号,上海市普陀区金鼎路
1417318,121.435,31.274,121.45200000000001,31.279,上海市普陀区西乡路,上海市闸北区万荣路373号
503090,121.40100000000001,31.264,121.406,31.281999999999996,上海市普陀区真北支路224号,上海市普陀区武威东路574号
367456,121.396,31.323,121.398,31.320999999999998,上海市宝山区西外环路,上海市宝山区泮池南路
1411463,121.49,31.264,121.50200000000001,31.273000000000003,上海市虹口区四川北路1688号,上海市虹口区张桥路192号
100640,121.51799999999999,31.273000000000003,121.521,31.268,上海市杨浦区飞虹路656号,上海市杨浦区昆明路659号
102711,121.417,31.17,121.432,31.163,上海市徐汇区漕宝路410-3号,上海市徐汇区桂林东街116号
106180,121.54899999999999,31.289,121.557,31.294,上海市杨浦区水丰路134号,上海市杨浦区控江路59弄-20号
535797,121.52799999999999,31.278000000000002,121.542,31.285,上海市杨浦区周家嘴路2521号,上海市杨浦区辽源东路59号
1498288,121.461,31.215,121.464,31.214000000000002,上海市徐汇区太原路79号,上海市徐汇区襄阳南路354号
793387,121.506,31.302,121.508,31.303,上海市杨浦区邯郸路178弄-6号,上海市杨浦区博学北路
1676004,121.449,31.252,121.45100000000001,31.254,上海市普陀区普陀路126号,上海市普陀区昌化路1100-1号
1085886,121.508,31.259,121.51100000000001,31.261999999999997,上海市虹口区唐山路286号,上海市虹口区公平路462号
1632444,121.39399999999999,31.223000000000003,121.396,31.223000000000003,上海市长宁区长宁路,上海市长宁区天中路155号
1225132,121.459,31.214000000000002,121.465,31.206,上海市徐汇区岳阳路77弄1-21号,上海市徐汇区清真路58弄-16号
377478,121.42299999999999,31.209,121.42299999999999,31.211,上海市长宁区杨宅路265号,上海市长宁区新华路827号
846356,121.383,31.237,121.415,31.239,上海市普陀区伯士路57号,上海市普陀区杏山路61号
1561310,121.465,31.197,121.47,31.195,上海市徐汇区枫林路,上海市徐汇区小木桥路700号
122264,121.32700000000001,31.129,121.35600000000001,31.138,上海市松江区九新公路302弄-50号,上海市闵行区中春路6689弄
1502330,121.305,31.259,121.314,31.26,上海市嘉定区G42(京沪高速),上海市嘉定区金园五路
717523,121.46,31.289,121.462,31.291,上海市闸北区灵石路,上海市闸北区彭江路234
1686656,121.5,31.397,121.5,31.398000000000003,上海市宝山区双城路339弄-1-188号,上海市宝山区永清路470号
68608,121.48100000000001,31.301,121.499,31.308000000000003,上海市虹口区车站南路330弄-2号-6号-d-5单元,上海市杨浦区武川路75弄-28-29号
886677,121.51299999999999,31.294,121.51899999999999,31.291999999999998,上海市杨浦区国泰路85弄,上海市杨浦区内环高架路
1210089,121.31,31.245,121.322,31.238000000000003,上海市嘉定区X213,上海市嘉定区鸿宁路
69655,121.531,31.323,121.535,31.333000000000002,上海市杨浦区国和路,上海市杨浦区殷行路
1096605,121.416,31.208000000000002,121.421,31.214000000000002,上海市长宁区伊犁路158号,上海市长宁区天山路1913号
1737712,121.455,31.214000000000002,121.49,31.232,上海市徐汇区衡山路15号,上海市黄浦区人民路879号-1
316719,121.44200000000001,31.278000000000002,121.45100000000001,31.279,上海市闸北区沪太路903弄-3号,上海市闸北区万荣路366号
689692,121.485,31.212,121.49,31.215999999999998,上海市黄浦区蒙自路207号,上海市黄浦区陆家浜路1382弄-46号
1436119,121.40899999999999,31.223000000000003,121.411,31.230999999999998,上海市长宁区云雾山路266号,上海市普陀区友谊路
1578022,121.444,31.265,121.45100000000001,31.269000000000002,上海市普陀区洛川路292号,上海市普陀区洛川路30弄-1-2号
219135,121.469,31.325,121.484,31.320999999999998,上海市闸北区景凤路205弄-16号,上海市宝山区安汾路580号
93962,121.444,31.298000000000002,121.448,31.305999999999997,上海市闸北区江场三路28号,上海市闸北区万荣路1505
869637,121.447,31.316999999999997,121.448,31.316999999999997,上海市闸北区临汾路1294号,上海市闸北区临汾路1269号
1270864,121.462,31.198,121.491,31.209,上海市徐汇区零陵路345号,上海市黄浦区汝南街53号
1117109,121.40899999999999,31.143,121.415,31.151999999999997,上海市闵行区莲花路189号,上海市闵行区顾戴路5号
1753897,121.426,31.245,121.462,31.206,上海市普陀区武宁路528号,上海市徐汇区医学院路69号
1801798,121.454,31.256999999999998,121.46700000000001,31.250999999999998,上海市普陀区远景路97弄-52,上海市闸北区华盛路219号
1132692,121.478,31.263,121.48899999999999,31.248,上海市闸北区通阁路3号-临,上海市闸北区北苏州路470号
275413,121.47,31.244,121.48200000000001,31.246,上海市静安区新闸路1528弄1号,上海市黄浦区厦门路142号
1703800,121.484,31.267,121.48899999999999,31.264,上海市虹口区东宝兴路623号,上海市虹口区四川北路1717号-5-f
245791,121.381,31.233,121.38799999999999,31.245,上海市普陀区云岭西路,上海市普陀区真北路962弄-1-377号
349787,121.404,31.163,121.411,31.151,上海市闵行区东兰路320号-c-23号,上海市闵行区古美路569号
1606986,121.521,31.285999999999998,121.53200000000001,31.287,上海市杨浦区抚顺路242号,上海市杨浦区延吉中路555弄1-18号
1378257,121.37299999999999,31.113000000000003,121.384,31.111,上海市闵行区西环路301号,上海市闵行区莘浜路178号
1171531,121.551,31.279,121.55799999999999,31.273000000000003,上海市杨浦区隆昌路511号,上海市杨浦区杨树浦路2464号
218535,121.445,31.279,121.478,31.285999999999998,上海市闸北区运城路352号,上海市虹口区广中路373号
1624473,121.399,31.278000000000002,121.406,31.29,上海市普陀区桃浦西路373号,上海市普陀区真北路3725弄-61号
289827,121.45100000000001,31.228,121.464,31.23,上海市静安区南京西路1717号,上海市静安区延安中路549号
74501,121.536,31.289,121.54299999999999,31.288,上海市杨浦区延吉中路231-237,上海市杨浦区控江路
1677347,121.31700000000001,31.269000000000002,121.32600000000001,31.271,上海市嘉定区金园二路501号,上海市嘉定区曹安公路2888号
651820,121.48200000000001,31.232,121.488,31.233,上海市黄浦区武胜路288号,上海市黄浦区金陵东路549号
703611,121.46600000000001,31.249000000000002,121.486,31.250999999999998,上海市闸北区梅园路101号,上海市闸北区上海七浦路服装批发市场九街a-266号
361978,121.429,31.156,121.436,31.159000000000002,上海市徐汇区沪闵路辅路,上海市徐汇区沪闵路289号
278627,121.339,31.149,121.346,31.139,上海市松江区涞亭南路95号,上海市松江区九亭大街105弄
1762148,121.333,31.293000000000003,121.35,31.281,上海市嘉定区众仁路,上海市普陀区金昌路2205
411825,121.47399999999999,31.283,121.48200000000001,31.295,上海市虹口区新同心路215号,上海市虹口区水电路1200弄-16号
1330534,121.506,31.233,121.541,31.236,上海市黄浦区中山东二路515号400室,上海市浦东新区源深路622号
321335,121.375,31.19,121.37899999999999,31.193,上海市闵行区虹井路663号,上海市闵行区程家桥路150号
1198841,121.47200000000001,31.3,121.508,31.296999999999997,上海市虹口区广粤支路19号,上海市虹口区松花江路
314027,121.506,31.315,121.508,31.316,上海市杨浦区政立路669弄-9号,上海市杨浦区政立路545弄-50号
510969,121.416,31.217,121.427,31.212,上海市长宁区天山路1756号,上海市长宁区新华路666弄-1-5号
1224141,121.395,31.252,121.40100000000001,31.25,上海市普陀区武宁路2525弄-88号,上海市普陀区梅岭北路1258弄
454245,121.428,31.141,121.431,31.138,上海市徐汇区凌云路228号,上海市徐汇区龙州路
888018,121.47399999999999,31.296999999999997,121.48200000000001,31.29,上海市虹口区广粤路418号-1楼,上海市虹口区广灵二路222弄-1号
1132418,121.34299999999999,31.151999999999997,121.348,31.155,上海市闵行区嘉闵高架路,上海市闵行区中春路7468号
859099,121.44,31.313000000000002,121.446,31.322,上海市闸北区康宁路1089号,上海市闸北区三泉路
370415,121.501,31.274,121.515,31.296999999999997,上海市虹口区四平路510号,上海市杨浦区国年路99弄-8号
897742,121.531,31.319000000000003,121.53200000000001,31.33,上海市杨浦区恒仁路258号,上海市杨浦区世界路151弄-10号
579015,121.479,31.340999999999998,121.48299999999999,31.346999999999998,上海市宝山区通南路,上海市宝山区郁江巷路
1379440,121.31700000000001,31.309,121.323,31.3,上海市嘉定区S5(沪嘉高速),上海市嘉定区民主东路123号
866111,121.478,31.267,121.479,31.273000000000003,上海市闸北区宝昌路620弄-4号,上海市虹口区中山北路64-1号
1626522,121.535,31.3,121.556,31.285,上海市杨浦区国顺东路,上海市杨浦区内江路168弄-1号
1436980,121.46,31.218000000000004,121.47200000000001,31.223000000000003,上海市徐汇区复兴中路1348号,上海市黄浦区皋兰路22
1117869,121.458,31.264,121.48,31.26,上海市闸北区中山北路998号1楼,上海市闸北区临山路206弄-2号
1527228,121.42299999999999,31.204,121.443,31.185,上海市长宁区长顺路11号706c,上海市徐汇区漕溪路93号303室
1260480,121.455,31.237,121.459,31.23,上海市静安区新闸路1473号,上海市静安区延安中路1000
1389675,121.444,31.258000000000003,121.448,31.255,上海市普陀区中潭路99号-143号,上海市普陀区宜昌路
1074430,121.471,31.305999999999997,121.485,31.305,上海市虹口区奎照路969号,上海市虹口区水电路1421弄-5幢
1403729,121.51899999999999,31.316999999999997,121.52,31.318,上海市杨浦区三门路138号,上海市杨浦区市光路70弄-20号
98319,121.469,31.279,121.48899999999999,31.271,上海市闸北区平型关路453号,上海市虹口区四川北路2084号
700996,121.42,31.285999999999998,121.43,31.279,上海市宝山区华灵路1393号,上海市宝山区华灵路411弄-12号
876261,121.447,31.19,121.45700000000001,31.175,上海市徐汇区零陵路725号,上海市徐汇区天钥桥南路399号
1551045,121.419,31.195,121.426,31.206,上海市闵行区张虹路131号,上海市长宁区安顺路163号
1247304,121.42200000000001,31.283,121.428,31.285999999999998,上海市宝山区大华路921号,上海市宝山区华灵路1055号
872390,121.43700000000001,31.225,121.456,31.228,上海市长宁区安西路37号,上海市静安区延安中路1007
1049890,121.477,31.276,121.477,31.276999999999997,上海市虹口区西宝兴路949弄-75号,上海市虹口区西宝兴路949弄-82号
1518543,121.463,31.180999999999997,121.47,31.195,上海市徐汇区云锦路,上海市徐汇区小木桥路700号
1298050,121.491,31.289,121.509,31.304000000000002,上海市虹口区赤峰西路625弄1号,上海市杨浦区相伯路
1537027,121.38799999999999,31.252,121.42299999999999,31.250999999999998,上海市普陀区真光路,上海市普陀区武宁路766号
937901,121.471,31.291,121.48,31.285999999999998,上海市虹口区广灵四路757号,上海市虹口区广中路345号
115609,121.53200000000001,31.323,121.538,31.331,上海市杨浦区世界路51号,上海市杨浦区开鲁路434号
1487763,121.51799999999999,31.294,121.531,31.296999999999997,上海市杨浦区国权路225号,上海市杨浦区国权东路88
